Outcome,Board of Health,Building and Zoning Services,CelebrateOne,City Attorney,City Auditor,City Council,Civil Service,Civil Service Commission,Development,Diversity and Inclusion,Finance and Management,Health,Human Resources,Inspector General,Office of the Mayor,Neighborhoods,Public Safety,Public Service,Public Utilities,Recreation and Parks,Recreation and Parks Commission,Technology,Treasurer's Office,Violence Prevention
Outcome,(n = 6),(n = 135),(n = 7),(n = 44),(n = 44),(n = 12),(n = 15),(n = 22),(n = 65),(n = 7),(n = 111),(n = 340),(n = 46),(n = 11),(n = 15),(n = 47),(n = 329),(n = 311),(n = 435),(n = 189),(n = 6),(n = 64),(n = 2),(n = 22)
Scale Score,4.00,4.31,4.14,4.24,4.35,4.04,4.10,3.92,4.07,3.98,3.91,4.23,4.59,4.24,4.30,4.12,3.87,4.25,3.99,3.96,4.44,3.87,4.33,4.07
I am clear about which actions I am allowed to take on my own and which actions require approval from my supervisor.,4.00,4.21,3.14,4.30,4.16,3.83,4.13,4.14,3.89,4.29,3.92,4.09,4.43,4.36,4.20,4.04,3.94,4.10,3.90,3.79,4.33,3.64,4.50,3.95
My supervisor does a good job of setting work expectations and performance goals.,3.67,4.30,4.43,4.14,4.34,4.08,4.13,4.09,4.00,3.71,3.87,4.19,4.46,4.36,4.07,3.94,3.85,4.24,3.95,3.94,4.33,3.84,4.50,3.95
My supervisor keeps me well informed about what's going on in the department.,3.83,4.19,4.14,4.02,4.34,4.00,4.00,3.64,3.57,3.86,3.64,4.13,4.59,3.91,4.20,3.96,3.67,4.14,3.89,3.83,4.00,3.63,3.50,4.09
My supervisor cares and is responsive to the issues of most importance to me.,4.00,4.36,4.43,4.23,4.41,4.25,4.07,3.73,4.26,4.00,3.97,4.29,4.63,4.18,4.47,4.19,3.88,4.31,4.03,4.04,4.67,4.06,4.50,4.09
My supervisor is supportive of me attending internal organizational activities beyond my assigned tasks.,4.50,4.36,4.29,4.25,4.34,4.17,4.13,4.14,4.32,4.43,3.96,4.41,4.72,4.36,4.47,4.30,3.93,4.30,4.11,4.14,4.67,4.06,4.50,4.23
